{
  "id": "chicken-caprese-skillet",
  "origin": "curated",
  "language": "en",
  "categories": [
    "Dinner"
  ],
  "title": "Chicken Caprese Skillet",
  "description": "Pan-seared chicken breast topped with melted mozzarella, fresh tomatoes and a balsamic reduction.",
  "image": "https://images.unsplash.com/photo-1603894584373-5ac82b2ae398?auto=format&fit=crop&w=1200&q=85",
  "time": 35,
  "calories": 419,
  "protein": 48,
  "carbs": 21,
  "tags": [
    "Chicken",
    "Italian"
  ],
  "ingredients": [
    "2 chicken breasts",
    "2 tomatoes, sliced",
    "80 g part-skim mozzarella, sliced",
    "2 tbsp balsamic vinegar",
    "1 tbsp olive oil",
    "Fresh basil",
    "Salt and pepper"
  ],
  "steps": [
    "Sear the chicken in a hot skillet until nearly cooked through.",
    "Top with tomato and mozzarella, cover and cook until the cheese melts.",
    "Reduce the balsamic vinegar in a small pan and drizzle over, finishing with fresh basil."
  ],
  "source": {
    "label": "Adapted from Skinnytaste chicken caprese skillet",
    "url": "https://www.skinnytaste.com/caprese-chicken-skillet/"
  },
  "notes": "One pan, minimal cleanup — a genuinely quick weeknight dinner with a restaurant-style presentation."
}
