{
  "id": "everything-bagel-eggs",
  "origin": "curated",
  "language": "en",
  "categories": [
    "Snack"
  ],
  "title": "Everything Bagel Hard-Boiled Eggs",
  "description": "Hard-boiled eggs halved and sprinkled with everything bagel seasoning for a 2-minute high-protein snack.",
  "image": "https://images.unsplash.com/photo-1567521464027-f127ff144326?auto=format&fit=crop&w=1200&q=85",
  "time": 12,
  "calories": 140,
  "protein": 12,
  "carbs": 1,
  "tags": [
    "No cook",
    "Quick"
  ],
  "ingredients": [
    "4 large eggs",
    "1 tbsp everything bagel seasoning",
    "Pinch of flaky salt"
  ],
  "steps": [
    "Boil the eggs 9-10 minutes, then cool in ice water and peel.",
    "Halve the eggs and season generously with the bagel seasoning.",
    "Store in the fridge for up to 4 days."
  ],
  "source": {
    "label": "Adapted from EatingWell high-protein snacks",
    "url": "https://www.eatingwell.com/recipes/high-protein-snacks/"
  },
  "notes": "Keep a batch of boiled eggs ready in the fridge at all times — this is the fastest protein snack there is."
}
