{
  "id": "tofu-stir-fry-broccoli",
  "origin": "curated",
  "language": "en",
  "categories": [
    "Lunch",
    "Dinner"
  ],
  "title": "Crispy Tofu & Broccoli Stir-Fry",
  "description": "Pan-fried pressed tofu in a garlic-ginger sauce with charred broccoli and cashews.",
  "image": "https://images.unsplash.com/photo-1535291692377-b7eb2fb22a8b?auto=format&fit=crop&w=1200&q=85",
  "time": 30,
  "calories": 340,
  "protein": 18,
  "carbs": 28,
  "tags": [
    "Vegetarian",
    "Tofu"
  ],
  "ingredients": [
    "400 g firm tofu, pressed and cubed",
    "4 cups broccoli florets",
    "60 ml low-sodium soy sauce",
    "2 tbsp rice vinegar",
    "1 tbsp sesame oil",
    "1 tbsp honey",
    "3 garlic cloves",
    "1 tbsp ginger, grated",
    "65 g roasted cashews"
  ],
  "steps": [
    "Press the tofu, then fry until golden on all sides and set aside.",
    "Stir-fry the broccoli until the edges char, then return the tofu.",
    "Add the sauce, toss to coat, and finish with cashews and scallions."
  ],
  "source": {
    "label": "Adapted from Skinnytaste vegetarian recipes",
    "url": "https://www.skinnytaste.com/recipes/vegetarian/"
  },
  "notes": "Pressing the tofu well before cooking is the single biggest factor in getting a crisp result."
}
