{
  "id": "pan-seared-tofu-bowls",
  "origin": "curated",
  "language": "en",
  "categories": [
    "Lunch",
    "Dinner"
  ],
  "title": "Pan-Seared Tofu Bowls with Chili Oil",
  "description": "Crisp-seared tofu over brown rice with edamame and broccoli, finished with a spoonful of chili oil.",
  "image": "https://images.unsplash.com/photo-1535291692377-b7eb2fb22a8b?auto=format&fit=crop&w=1200&q=85",
  "time": 25,
  "calories": 340,
  "protein": 22,
  "carbs": 35,
  "tags": [
    "Vegetarian",
    "Tofu"
  ],
  "ingredients": [
    "350 g extra-firm tofu, pressed and cubed",
    "200 g cooked brown rice",
    "100 g edamame",
    "150 g broccoli florets, steamed",
    "2 tbsp soy sauce",
    "1 tbsp chili oil"
  ],
  "steps": [
    "Sear the pressed tofu in a hot pan until golden on most sides.",
    "Toss with soy sauce.",
    "Build bowls with rice, broccoli, edamame and tofu, then finish with chili oil."
  ],
  "source": {
    "label": "Adapted from Skinnytaste pan-seared tofu bowls",
    "url": "https://www.skinnytaste.com/pan-seared-tofu-bowls/"
  },
  "notes": "Pressing the tofu for at least 15 minutes is the difference between a crisp sear and a soggy one."
}
