{
  "id": "beef-chilli-sweet-potato",
  "origin": "curated",
  "language": "en",
  "categories": [
    "Dinner"
  ],
  "title": "Beef & Black Bean Chilli with Sweet Potato",
  "description": "Lean ground beef simmered with beans, peppers and warm spices, topped with baked sweet potato wedges.",
  "image": "https://images.unsplash.com/photo-1603894584373-5ac82b2ae398?auto=format&fit=crop&w=1200&q=85",
  "time": 45,
  "calories": 410,
  "protein": 32,
  "carbs": 48,
  "tags": [
    "Beef",
    "Comfort food"
  ],
  "ingredients": [
    "300 g lean ground beef",
    "1 onion, diced",
    "4 garlic cloves",
    "2 carrots, diced",
    "1 red bell pepper, diced",
    "1 tbsp chilli powder",
    "2 tsp cumin",
    "1 can black beans, drained",
    "1 can crushed tomatoes",
    "2 medium sweet potatoes, cut into wedges"
  ],
  "steps": [
    "Bake the sweet potato wedges until tender.",
    "Brown the beef, then sauté the vegetables and spices, and return the beef.",
    "Add the beans, tomatoes and broth, simmer 20 minutes, and serve topped with the sweet potato wedges."
  ],
  "source": {
    "label": "Adapted from BBC Good Food beef recipe collection",
    "url": "https://www.bbcgoodfood.com/recipes/category/red-meat-and-game-collections"
  },
  "notes": "Sweet potato's resistant starch feeds gut bacteria — pair it with the lean beef here for bioavailable iron too."
}
